"Monticello Drug Company, S.A.",Amatista No. 54,Estrella,07810,"Gustavo A.
Madero",D.F.,09007020001,04-sep.-13,"SÓLIDOS ORALES: Tabletas; SEMISÓLIDOS:
Ungüento.",Vigente,Vigente,Ninguna,"Sólidos orales, Semisólidos.",163300ER020166,18-ago.-16,21-feb.-18,Vencido
"More Pharma Corporation, S. de
R.L. de C.V.",Pirul No. 15 Int. A,San Jerónimo Tepetlacalco,54090,Tlalnepantla de Baz,Edo. de México,15104020004,28-ene.-13,"LÍQUIDOS ORALES: Jarabe, Suspensión.",Vigente,"Suspensión temporal del 18 de Octubre de 2017 al 12 de
febrero de 2018",Con fundamento en el Artículo 202 de la Ley General de Salud,N/A,N/A,N/A,N/A,N/A
"Nártex Laboratorios Homeopáticos,
S.A. de C.V.",Calzada Lázaro Cárdenas Oriente No. 770,Eduardo Guerra,27280,Torreón,Coahuila,05035020001,03-jul.-19,"SÓLIDOS: Homeopáticos, Herbolario: Tableta o comprimido, glóbulos;  LÍQUIDOS: Homeopático, Herbolario: Solución, Jarabe; SEMISÓLIDOS: Homeopáticos, Herbolarios: Ungüento, Pomada, Gel.",Vigente,Vigente,Ninguna,"Sólidos: Homeopáticos, Herbolarios; Líquidos: Homeopáticos, Herbolarios; Semisólidos: Homeopáticos, Herbolarios.",223300516A0392,03-may.-22,07-dic.-22,Vencido
"Naturalmedic Quim, S.A. de C.V.",Fray Bartolome de las Casas No. 8509,Tres Cruces,72595,Puebla,Puebla,21114020004,30-ago.-11,"SÓLIDOS ORALES: Tabletas; LÍQUIDOS ORALES:
Solución, Suspensión, Jarabe.",Vigente,Suspensión temporal del 20 de abril de 2018 al 01 de diciembre de 2023,Con fundamento en el Artículo 202 de la Ley General de Salud,Líquidos.,163300516A0942,11-nov.-16,28-abr.-18,Vencido
"Neolpharma, S.A. de C.V.",Blvd. de los Ferrocarriles No. 277,Industrial Vallejo,02300,Azcapotzalco,D.F.,09002020009,08-feb.-16,"SÓLIDOS: Tabletas, Tabletas efervescentes y/o solubles, Tabletas masticables, Tabletas recubiertas, Comprimidos, Comprimidos efervescentes, Cápsulas de gelatina dura, Cápsulas de gelatina blanda,
Granulado, Polvo para reconstituir, Grageas; LÍQUIDOS: Solución, Suspensión, Elixir, Jarabe; SEMISÓLIDOS: Supositorios, Crema, Ungüento, Gel, Jalea, Óvulo, Pomada, Pasta; ESTÉRILES: Parenterales de gran volumen solución inyectable en botella de polipropileno, Solución inyectable de pequeño volumen en ampolleta de plástico.",Vigente,Vigente,Ninguna,"Sólidos, Estériles, Líquidos, Semisólidos",203300EL530548,08-ene.-20,08-jul.-22,Vencido
"Nithi Tze, S.A. de C.V.",Kilometro 0.2,"Amomolulco
Ocoayoacac",52740,Ocoyoacac,Edo. de México,15062020005,15-jun.-09,SÓLIDOS ORALES: Tabletas.,Vigente,Vigente,Ninguna,N/A,N/A,N/A,N/A,N/A
Novag Infancia planta Tizayuca,Carretera San Bartolo Cuautlalpan No. 44,Barrio de Atempa,43800,Tizayuca,Hidalgo,13069020002,09-feb.-18,"SÓLIDOS: Tableta o comprimido, cápsulas, polvos y granulados; LÍQUIDOS: Jarabe, solución y suspensión",Vigente,Vigente,Ninguna,Sólidos y Líquidos.,COFEPRIS-CAS-SELS-18175- 2021,11-oct.-21,11-abr-2024,Vigente
"Novag Infancia, S.A. de C.V.",Calz. de Tlalpan No. 3417,Santa Ursula Coapa,04650,Coyoacan,D.F.,09004020009,06-jul.-18,"SÓLIDOS ORALES: Tabletas sublinguales, Tabletas, Comprimidos, Cápsulas de gelatina dura, Polvo para reconstituir, Grageas; LÍQUIDOS ORALES: Solución, Suspensión, Elixir, Jarabe;  SEMISÓLIDOS: Crema,
Pomada, Pasta.",Vigente,Vigente,Ninguna,"Sólidos orales, Líquidos orales y Semisólidos.",233300516A0474,21-abr.-23,25-nov.-23,Vigente
"Novartis Farmacéutica,S.A. de C.V.",Calz. de Tlalpan No. 1779,San Diego Churubusco,04120,Coyoacan,D.F.,09004020005,19-oct.-11,"SÓLIDOS ORALES: Tabletas, Tabletas de liberación prolongada, Comprimidos, Grageas, Grageas de liberación prolongada; SEMISÓLIDOS: Crema, Ungüento, Gel.",Vigente,"Suspendido del 30 de septiembre de 2021 al 30 de
septiembre de 2023",Con fundamento en el Artículo 202 de la Ley General de Salud,Sólidos orales y Semisólidos.,SLS/04/1232/2011,10-oct.-11,10-abr.-14,Vencido
"Novartis Farmacéutica,S.A. de C.V.",La Candelaria No. 186 Local A,Atlántida,04370,Coyoacan,D.F.,09004020036,08-may.-12,SÓLIDOS ORALES: Comprimidos.,Revocada,Suspención definitiva  a partir del 03 de Octubre de 2019.,Con fundamento en el Artículo 380 Fracción XI de la Ley General de Salud,N/A,N/A,N/A,N/A,N/A
"Nucitec, S.A. de C.V.",Comerciantes No. 15 Nave 3,Peñuelas,76148,Querétaro,Querétaro,22014020003,31-may.-02,"SÓLIDOS ORALES: Tabletas, Polvo para reconstituir; SÓLIDOS NO ORALES: Polvo tópico; LÍQUIDOS
ORALES: Solución, Suspensión, Jarabe.",Vigente,Suspensión de trabajos y servicios,"Con fundamento en los Artículos 402, 404,
412 y 414 de la Ley General de Salud.",N/A,N/A,N/A,N/A,N/A
"Nucitec, S.A. de C.V.",Av. Jurica No. 116,Parque Industrial Queréretaro,76220,Querétaro,Querétaro,22014020006,02-mar.-20,"SÓLIDOS: Tabletas o comprimidos, Tabletas
Recubiertas, Cápsulas de gelatina dura, Polvo; LÍQUIDOS: Solución, Jarabe.",Vigente,Vigente,Ninguna,"Sólidos, Líquidos",223300EL531725,13-abr.-23,13-oct.-25,Vigente
"Octapharma, S.A. de C.V.",Calz. México Tacuba No. 1419,Argentina Poniente,11230,Miguel Hidalgo,D.F.,09011020018,23-feb.-16,ESTÉRILES HEMODERIVADOS: Solución inyectable en frasco ámpula.,Vigente,Vigente,Ninguna,Estériles Hemoderivados,183501CI110038,03-jul.-18,04-mar.-19,Vencido
"Offenbach Mexicana, S.A. de C.V.",Acueducto No. 15,Reforma Social,11650,Miguel Hidalgo,Ciudad de México,09011020021,13-may.-19,"SÓLIDOS: Tabletas o Comprimidos, Tabletas recubiertas, Cápsulas de gelatina dura; SEMISÓLIDOS: Crema, Ungüento, Gel, Pomada.",Vigente,Vigente,Ninguna,"Sólidos, Semisólidos",223300EL530686,12-jul.-22,12-ene.-25,Vigente
"Olnatura, S.A. de C.V.","Calle 40 Sur esq. 9 este, Mz. 8",Civac,62500,Jiutepec,Morelos,17011020006,28-sep.-22,"SÓLIDOS: Tabletas o Comprimidos, Cápsulas de gelatina dura; SÓLIDOS HERBOLARIOS: Tabletas o Comprimidos, Cápsulas de gelatina dura, Polvo para reconstituir; SEMISÓLIDOS HERBOLARIOS: Crema, Ungüento, Gel.",Vigente,Vigente,Ninguna,"Sólidos orales, Sólidos orales Herbolarios y Semisólidos Herbolarios.",233300516A0171,14-feb.-23,07-sep.-23,Vigente
"Omni Prime Pack, S.A. de C.V.",Morelos No. 51,El Puente,05080,Cuajimalpa,D.F.,09005050001,13-dic.-19,"Acondicionamiento Primario: Llenado de Cápsula de
gelatina dura.",Vigente,Vigente,Ninguna,Sólidos,213300516A0851,30-jul.-21,29-mar.-22,Vencido
"Organización de Reactivos Biológicos e Inmunología, S.A. de C.V.",Av. Coyoacan No. 826,Del Valle,03100,Benito Juárez,D.F.,09003020025,13-sep.-06,"ESTÉRILES BIOTECNOLÓGICOS: Suspensión
inyectable en jeringa.",Vigente,Suspensión temporal del 01-03 22 al 01-03-24,Con fundamento en el Artículo 202 de la Ley General de Salud,N/A,N/A,N/A,N/A,N/A
"Perrigo de México, S.A. de C.V.",Av. Industria Automotriz No. 3089,Parque Industrial Saltillo Ramos Arizpe,25900,Ramos Arizpe,Coahuila,05027020001,14-mar.-00,SÓLIDOS ORALES: Polvo para reconstituir.,Revocada,Suspensión definitiva el 18 de abril de 2017,Con fundamento en el  Artículo 380 Fracción XI de la Ley General de Salud,N/A,N/A,N/A,N/A,N/A
"Pfizer, S.A. de C.V.",Km. 63 Carr. México Toluca,Zona Industrial,50140,Toluca,Edo. de México,15106020012,03-ene.-23,"SÓLIDOS: Tabletas o Comprimidos, Tabletas
efervescentes, Tabletas recubiertas, Cápsulas de gelatina dura, Polvo.  LÍQUIDOS: Solución,
Suspensión, Jarabe; SEMISÓLIDOS: Gel, Pomada.",Vigente,Vigente,Ninguna,"Sólidos, Líquidos y Semisólidos.",223300516A1418,12-dic.-22,21-jul.-23,Vigente
"Pharmacas, S.A. de C.V.",Carr. México-Toluca Km. 45,Juárez,52740,Ocoyoacac,Edo. de México,15062020002,05-sep.-05,"SÓLIDOS ORALES: Tabletas, Cápsulas de gelatina dura, Polvo para reconstituir.",Vigente,Suspensión temporal de actividades del 24 de abril de 2017 al 25 de abril de 2019,Con fundamento en el Artículo 202 de la Ley General de Salud,N/A,N/A,N/A,N/A,N/A
"Pharmacia & Upjohn, S.A. de C.V.",Calle 1 Sur No. 112 Lote 8 Mz. VI,Parque Industrial Toluca 2000,50200,Toluca,Edo. de México,15106020016,07-oct.-09,SÓLIDOS ORALES: Polvo para reconstituir.,Revocada,Suspensión definitiva desde 01 de agosto de 2018,Con fundamento en el  Artículo 380 Fracción XI de la Ley General de Salud,N/A,N/A,N/A,N/A,N/A
"Pharmacos Abug, S.A. de C.V.",Lago Ginebra No. 359,5 de Mayo,11470,Miguel Hidalgo,D.F.,09011020007,04-ago.-99,SÓLIDOS ORALES: Tabletas.,Vigente,Vigente,Ninguna,N/A,N/A,N/A,N/A,N/A
"Pharmacos Exakta, S.A. de C.V.",Av. Niño Obrero No. 651,Chapalita Sur,45040,Guadalajara,Jalisco,14039020012,26-ago.-02,"ESTÉRILES: Ungüento oftálmico, Solución oftálmica.",Vigente,Vigente,Vigente,"ESTÉRILES: Ungüento oftálmico, Solución oftálmica.",213300129X0171,11-ago.-22,11-feb.-25,Vigente
"Pharmagen, S.A. de C.V.",Adolfo López Mateos No. 68 Bis,Cuajimalpa,05000,Cuajimalpa,D.F.,09005020002,19-mar.-01,"SÓLIDOS ORALES: Tabletas, Cápsulas de gelatina dura, polvo para reconstituir; LÍQUIDOS ORALES: Solución, Suspensión.",Vigente,Vigente,Ninguna,N/A,N/A,N/A,N/A,N/A
"Pharmaservice, S.A. de C.V.",Calle 3 No. 28,Zona Industrial Benito Juárez,76120,Querétaro,Querétaro,22014020005,07-jul.-15,"ESTÉRILES: Solución inyectable en frasco ámpula, Solución inyectable en ampolleta, Liofilizado para solución inyectable en frasco ámpula. Emulsión inyectable en frasco ámpula, Emusión inyectable en ampolleta, Suspensión inyectable en frasco ámpula, Suspensión inyectable en ampolleta.",Vigente,Vigente,Ninguna,Estériles.,CAS/SELS/6637/2020,28-may.-20,28-nov.-22,Vencido
"Praxair México, S. de R.L. de C.V.",Ejido Pajaritos S/N,Gavilán Allende,96380,Coatzacoalcos,Veracruz,30039020001,21-abr.-15,GASES MEDICINALES: Bióxido de carbono en forma líquida y gas.,Vigente,Vigente,Ninguna,"Gases medicinales: Bióxido de
carbono.",223300CT110141,30-ene.-23,30-jul.-25,Vigente
"Praxair México, S. de R.L. de C.V.","Carretera Otumba-Ciudad
Sahagún Km 1+113,",Zona Industrial,43998,Tepeapulco,Hidalgo,13061020002,25-ago.-21,Gases Medicinales: Oxígeno Medicinal,Vigente,Vigente,Ninguna,Gases medicinales: Oxígeno.,"223300129X0048,
223300IT040684",20-ene.-23,20-jul.-25,Vigente
"Praxair México, S. de R.L. de C.V.",Av. Independencia Ote. No. 300,Zona Industrial Toluca,50070,Toluca,México,15106020011,09-jul.-14,"GASES MEDICINALES: Óxido nitroso, Oxígeno medicinal.",Vigente,Vigente,Ninguna,"Gases medicinales: Oxígeno, Óxido nitroso.",223300EL530846,01-sep.-22,01-mar.-25,Vigente
"Praxair México, S. de R.L. de C.V.",Camino Mesón del Norte No. 100,Parque Industrial Santa María,25903,Ramos Arizpe,Coahuila,"Autorización
Temporal por COVID-19",04-ago.-21,Gases Medicinales: Oxígeno,Vigente,Vigente,Ninguna,N/A,N/A,N/A,N/A,N/A
"Praxair México, S. de R.L. de C.V.",Calle 2 No. 2023,Zona Industrial,44900,Guadalajara,Jalisco,14039020019,04-nov.-16,Gases Medicinales: Oxígeno medicinal.,Vigente,Vigente,Ninguna,Gases Medicinales: Oxígeno.,213300CT110372,10-nov.-21,04-may.-22,Vencido
"Praxair México, S. de R.L. de C.V.","Av. Principal Manzana 30, Lote 217 A/B",Parque Industrial Tepeji del Río,42850,Tepejí del Río,Hidalgo,13063020003,09-feb.-16,"Gases Medicinales: Oxígeno, Nitrógeno, Argón.",Vigente,Vigente,Ninguna,"Gases Medicinales: Oxígeno, Nitrógeno, Argón.",213300CI110050,20-may.-21,22-jul.-23,Vigente
"Praxair México, S. de R.L. de C.V.",Av. de la Juventud No. 614 Norte,Fracc. Industrial Nogalar,66480,Monterrey,Nuevo León,19039020004,08-ene.-15,"Gases Medicinales: Oxígeno, Nitrógeno, Dióxido de Carbono, Mezcla de aire (Oxígeno 21% / Nitrógeno 79%).",Vigente,Vigente,Ninguna,"Gases medicinales: Oxigeno, Nitrógeno, Dióxido de Carbono y Aire (Oxígeno 21%/ Nitrógeno 79%)",COFEPRIS-CAS-SELS- 19246-2022,30-nov.-22,30-may.-25,Vigente
"Praxair México, S. de R.L. de C.V.",Vía Matamoros No. 700,Garza Cantú,64550,"San Nicolás de
los Garza",Nuevo León,19046020002,11-feb.-15,"Gases Medicinales: Oxígeno medicinal, Nitrógeno
medicinal.",Vigente,Vigente,Ninguna,"Gases Medicinales: Oxigeno y
Nitrogeno","223300IT040014,
213300129X0301",25-jul.-22,25-ene.-25,Vigente
"Praxair México, S. de R.L. de C.V.","Carretera Nuevo Teapa El
Chapo Km. 1.5",El Chapo,96400,Coatzacoalcos,Veracruz,30039020002,21-oct.-19,"GASES MEDICINALES: Oxígeno Medicinal y
Nitrógeno.",Vigente,Vigente,Ninguna,"Gases medicinales: Oxigeno y
Nitrógeno",223300516A0943,24-ago.-22,06-feb.-23,Vencido
"Praxair México, S. de R.L. de C.V.",Robles No. 219,Fracc. Industrial Bruno Pagliai,91697,Tejeria,Veracruz,Autorización Temporal por COVID-19,05-ago.-21,Óxígeno Medicinal,Vigente,Vigente,Ninguna,N/A,N/A,N/A,N/A,N/A
"Praxair México, S. de R.L. de C.V.",Aut. México-Querétaro Km. 32.5,Lechería,54900,Tultitlan,México,15109020001,20-jun.-16,"Gases: Mezclas de óxido nítrico balance nitrógeno, Oxígeno medicinal, Nitrógeno medicinal, Aire, Mezcla de Oxigeno balance Helio, Helio, Argón.",Vigente,Vigente,Ninguna,"balance nitrógeno, Oxígeno medicinal, Nitrógeno medicinal, Aire, Mezcla de Oxigeno balance",213300CI110031,08-mar.-21,03-ago.-23,Vigente
"Praxair México, S. de R.L. de C.V.",Calle 1 Poniente No. 126,Ciudad Industrial Nueva Tijuana Otay,22000,Tijuana,Baja California,02004050003,22-mar.-21,Gases Medicinales: Oxígeno,Vigente,Vigente,Ninguna,N/A,N/A,N/A,N/A,N/A
"Probiomed, S.A. de C.V.",Yacatas No. 307,Narvarte,03020,Benito Juárez,D.F.,09003020017,23-ene.-02,"SÓLIDOS ORALES: Tabletas, Tabletas de liberación prolongada, Tabletas recubiertas, Comprimidos, Cápsulas de gelatina dura, Grageas, Grageas  de liberación prolongada.",Vigente,Vigente,Ninguna,Sólidos orales.,223300IT040187,17-jun.-22,17-dic.-24,Vigente
"Probiomed, S.A. de C.V.",San Esteban No. 88,Santo Tomás,02020,Azcapotzalco,D.F.,09002020001,30-ene.-09,"ESTÉRILES BIOTECNOLÓGICOS: Suspensión
inyectable en frasco ámpula, Solución inyectable en frasco ámpula, Solución inyectable en jeringa, Liofilizado para solución inyectable en frasco ámpula.",Vigente,Vigente,Ninguna,Estériles Biotecnológicos.,223300EL530694,27-oct.-22,27-abr.-25,Vigente
"Probiomed, S.A. de C.V.",Maíz No. 20,Granjas Esmeralda,09810,Iztapalapa,D.F.,09009020009,21-sep.-15,SÓLIDOS ORALES: Tabletas recubiertas; ESTÉRILES: Parenterales de pequeño volumen solución inyectable en ampolleta de vidrio.,Revocada,Suspensión definitiva el 21 de septiembre de 2016,Con fundamento en el  Artículo 380 Fracción XI de la Ley General de Salud,"Sólidos orales, Estériles.",143300IT010231,26-mar.-14,03-mar.-16,Vencido
"Procter & Gamble Manufacturing México, S. de R.L. de C.V.",San Andrés Atoto No. 326,San Francisco Cuautlalpan,53560,Naucalpan de Juárez,México,15057020008,07-jun.-17,"SÓLIDOS: Tabletas o comprimidos, Granulado; LÍQUIDOS: Solución, Suspensión, Jarabe; SEMISÓLIDOS: Ungüento.",Vigente,Vigente,Ninguna,"Sólidos, Líquidos, y Semisólidos.","213300EL530130,
213300EL530496",16-abr.-21,16-oct.-23,Vigente
"Productos Científicos, S.A. de C.V.",Nicolas San Juan No. 1046,Del Valle,03100,Benito Juárez,D.F.,09003020001,19-ago.-21,"SÓLIDOS: Tabletas o Comprimidos, Cápsulas de gelatina dura, Polvo; LÍQUIDOS: Solución, Suspensión, Jarabe, Emulsión, SEMISÓLIDOS: Supositorio, Crema, Gel, Óvulo, Pomada; ESTÉRILES: Solución nasal; ESTÉRILES HORMONALES: Suspensión inyectable en ampolleta, solución inyectable en ampolleta,
Solución inyectable en jeringa, Suspensión inyectable en jeringa; SEMISÓLIDOS HORMONALES: Ungüento, óvulos.",Vigente,Vigente,Ninguna,"Sólidos, Líquidos, Semisólidos, Estériles, Estériles Hormonales, Semisólidos Hormonales.",233300516A0152,16-feb.-23,06-oct.-23,Vigente
"Productos Farmacéuticos Collins,
S.A. de C.V.",Av. López Mateos No. 1938,Agua Blanca Industrial,45235,Zapopan,Jalisco,14120020012,26-ene.-15,"SÓLIDOS ORALES: Tabletas, Tabletas masticables, Tabletas recubiertas, Comprimidos, Cápsulas de gelatina dura, Polvo para reconstituir; LÍQUIDOS ORALES: Solución, Suspensión, Elixir, Jarabe, Vino medicinal; SEMISÓLIDOS: Crema, Ungüento, Gel, Pomada; ESTÉRILES: Solución inyectable en ampolleta, Solución oftálmica, Solución ótica, Solución nasal; SÓLIDOS ORALES BETALACTÁMICOS:
Tabletas, Tabletas recubiertas, Cápsulas de gelatina dura, Polvo para reconstituir; ESTÉRILES BETALACTÁMICOS: Polvo para suspensión inyectable en frasco ámpula.",Vigente,Vigente,Ninguna,"Sólidos orales, Líquidos orales, Semisólidos, Estériles, Sólidos orales Betalactámicos, Estériles- Betalactámicos.",233300516A0458,24-abr.-23,30-nov.-23,Vigente
"Productos Farmacéuticos Collins,
S.A. de C.V.",Ciprés No. 1677,Del Fresno,44900,Guadalajara,Jalisco,14039020020,21-ene.-16,"SÓLIDOS ORALES: Tabletas, Tabletas recubiertas;
SEMISÓLIDOS: Crema; ESTERILES: Solución Oftálmica, Solución Nasal.",Vigente,Vigente,Ninguna,"Sólidos orales, Semisólidos, Estériles.",CAS-SELS-9298-2022,08-jul.-22,08-ene.-25,Vigente
"Productos Farmaceuticos Collins,
S.A. de C.V.",Calle Melchor Ocampo No. 1590,El Vigia,45140,Zapopan,Jalisco,14120020019,06-jun.-22,"Sólidos: tabletas, tabletas masticables, tabletas recubiertas y cápsulas de gelatina dura",Vigente,Vigente,Ninguna,N/A,N/A,N/A,N/A,N/A
"Productos Farmacéuticos, S.A. de C.V.",Lago Tangañica No. 18,Granada,11520,Miguel Hidalgo,D.F.,09011020006,19-jul.-07,"LÍQUIDOS NO ORALES: Emulsión, Suspensión, Solución shampoo; SEMISÓLIDOS: Crema, Pomada.",Revocada,Suspensión definitiva el 14 de diciembre de 2017,Con fundamento en el  Artículo 380 Fracción XI de la Ley General de Salud,N/A,N/A,N/A,N/A,N/A
"Productos Farmacéuticos, S.A. de C.V.",Km. 4.2 Carretera Pabellón de Hidalgo,N/I,20420,Rincón de Romos,Aguascalientes,01007020001,08-sep.-21,"SÓLIDOS: Tabletas o comprimidos, Tabletas recubiertas, Cápsulas de gelatina dura, Polvo; LÍQUIDOS: Solución, Suspensión, Jarabe, emulsión, Tintura; SEMISÓLIDOS: Supositorio, Crema, Ungüento, Gel, Óvulo, Pomada; ESTÉRILES: Suspensión inyectable en frasco ámpula, Solución inyectable en ampolleta, Solución inyectable en frasco ámpula, Solución nasal, Solución oftálmica, suspensión inyectable en jeringa prellenada, solución inyectable en jeringa prellenada.",Vigente,Vigente,Ninguna,"Sólidos Orales, Líquidos Orales, Líquidos no Orales, Semisólidos, Estériles.",223300516A1379,29-nov.-22,14-jul.-23,Vigente
"Productos Maver, S.A. de C.V.",Oleoducto No. 2804,Álamo Industrial,45593,Tlaquepaque,Jalisco,14098020001,02-mar.-23,"SÓLIDOS: Tabletas o comprimidos, Tabletas recubiertas, Cápsulas de gelatina dura, Granulado, Polvo; Herbolarios: Cápsulas de gelatina dura; SEMISÓLIDOS: Crema, Gel, Ungüento, Herbolarios: Crema; ESTÉRILES: Solución inyectable en ampolleta, Solución inyectable en jeringa prellenada, Suspensión inyectable en ampolleta, Liofilizado para solución inyectable en frasco ámpula, Solución inyectble en frasco ámpula; SÓLIDOS-CEFALOSPORÍNICOS: Tabletas o comprimidos, Tabletas recubiertas, Cápsulas de gelatina dura, Polvo.",Vigente,Vigente,Ninguna,"Sólidos, Semisólidos, Estériles, Sólidos Cefalosporínicos, Líquidos - herbolarios.",223300516A1156,19-oct.-22,08-jun.-23,Vigente
"Productos Maver, S.A. de C.V.","Carretera a San Martín de las Flores No. 520, Int. 6",Parque Industrial Cedros,45620,Tlaquepaque,Jalisco,14098020004,07-ene.-21,"LÍQUIDOS: Solución, Suspensión, Jarabe, Gel. LÍQUIDOS HERBOLARIOS: Solución, Suspención y jarabe, SÓLIDOS-BETALACTAMICOS: Tabletas o comprimidos, Tabletas recubiertas, cápsulas de gelatina dura y polvo para recontituir. Sólidos: Tabletas o comprimidos, tabletas recubiertas,
granulado y polvo. Acondicionamiento Primario y Secundario: Cápsulas de gelatina dura.",Vigente,Vigente,Ninguna,"Líquidos, Sólidos, Sólidos- Betalactámicos.",213300EL532158,03-jun.-22,03-dic.-24,Vigente
"Productos Medix, S.A. de C.V.",Calz. Del Hueso No. 39 y 45,Ex Ejido de Sta. Ursula Coapa,04650,Coyoacan,D.F.,09004020034,01-oct.-21,"SÓLIDOS: Tabletas o Comprimidos, Cápsulas de
gelatina dura, Cápsulas de gelatina blanda, Tabletas recubiertas, Herbolarios: Tabletas o comprimidos, Cápsulas de gelatina dura, Cápsulas de gelatina
blanda; LÍQUIDOS: Solución, Suspensión, Elixir,",Vigente,Vigente,Ninguna,"Sólidos, sólidos herbolarios, Líquidos, Semisólidos .",213300EL531699,03-dic.-21,03-jun.-24,Vigente
"Productos Roche, S.A. de C.V.","Via Isidro Fabela Nte. No.
1536-B",Parque Industrial,50030,Toluca,México,15106020008,26-oct.-16,"SÓLIDOS: Tableta o comprimidos; tabletas
recubiertas; LIQUIDOS: Solución, Suspensión;",Revocada,"Suspensión definitiva el 20 de
agosto de 2018","Con fundamento en
el  Artículo 380","Sólidos orales, Líquidos orales,
Sólidos orales Oncológicos.","163300129X0320,
173300IT040100",07-mar.-17,17-ago.-19,Vencido
"Progela, S.A. de C.V.",Escocia No. 44,Parque San Andrés,04040,Coyoacán,Ciudad de México,09004020019,31-ago.-22,SÓLIDOS: Cápsulas de gelatina blanda.,Vigente,Vigente,Ninguna,Sólidos,213300516A0963,16-ago.-21,26-jun.-22,Vencido
"Progela, S.A. de C.V.",Poniente 148 No. 974,Industrial Vallejo,02300,Azcapotzalco,Ciudad de México,09002020006,01-jun.-22,SÓLIDOS: Cápsulas de gelatina blanda.,Vigente,Vigente,Ninguna,N/A,N/A,N/A,N/A,N/A
"Propulsora de Homeopatía, S.A. de C.V.",Mirto No. 26,Santa María la Ribera,06400,Cuauhtémoc,D.F.,09006030001,07-feb.-05,"SÓLIDOS ORALES: Tabletas, Globulos; SÓLIDOS NO ORALES: Polvo tópico; LÍQUIDOS ORALES: Solución, Elixir; SEMISÓLIDOS: Gel, Pomada.",Vigente,Vigente,Ninguna,N/A,N/A,N/A,N/A,N/A
"Protein,  S.A. de C.V.",Añil No. 865,Granjas México,08400,Iztacalco,D.F.,09008020004,18-oct.-00,"SÓLIDOS ORALES: Tabletas, Tabletas masticables,
Comprimidos, Cápsulas de gelatina dura, Polvo para reconstituir, Grageas, Pastilla; SÓLIDOS NO ORALES:",Vigente,"Suspensión del área de
fabricación del área de polvos
del 25 de septiembre de 2021","Con fundamento en
el Artículo 202 de la
Ley General de Salud","Sólidos orales, Sólidos No orales, Líquidos orales, Semisólidos.",203300EL531828,15-feb.21,15-ago.-23,Vigente
"Pro-Ventas, S.A. de C.V.",General León No. 40,San Miguel Chapultepec,11850,Miguel Hidalgo,D.F.,09011020022,25-mar.-11,"SÓLIDOS ORALES: Tabletas, Tabletas masticables.",Vigente,Vigente,Ninguna,Sólidos orales.,"173300EL531362,
173300CT110369,
173300EL531865",16-nov.-17,16-dic.-19,Vencido
"Psicofarma, S.A. de C.V.",Calz. de Tlalpan No. 4369,Toriello Guerra,14050,Tlalpan,D.F.,09014020009,23-oct.-17,"SÓLIDOS ORALES: Tabletas, Tabletas efervescentes
y/o solubles, Tabletas de liberación prolongada, Tabletas masticables, Tabletas recubiertas, Comprimidos efervescentes, Cápsulas de Gelatina
dura, Cápsulas de gelatina dura de liberación",Vigente,"Suspensión del área de estériles oncólogicos del 31 de julio de 2018 al 28 de
diciembre de 2019",Con fundamento en el Artículo 202 de la Ley General de Salud,"Sólidos Orales, Estériles.",213300516A0216,04-mar.-21,28-jul.-21,Vencido
"Psicofarma, S.A. de C.V.","Av. División del Norte No. 3377, interior 4",El Rosario,04380,Coyoácan,Ciudad de México,09004020037,17-dic.-20,"estériles: Solución inyectable en ampolleta, Solución Inyectable en frasco ámpula, Suspensión inyectable en ampolleta, Suspensión Inyectable en frasco ámpula y Solución inyectable en jeringa.",Vigente,Vigente,ninguna,Estériles,223300EL530023,27-jun.-22,27-dic.-24,Vigente
"Psicofarma, S.A. de C.V.",Blvd. Isidro Fabela No. 1238,Santa Cruz Azcapotzaltongo,50030,Toluca,México,15106020020,18-abr.-22,"SÓLIDOS: Tabletas o comprimidos, Tabletas recubiertas, Cápsulas de Gelatina dura, Granulado, Polvo, Tabletas efervescentes. LÍQUIDOS: Solución, Suspensión.",Vigente,Vigente,Ninguna,"Sólidos, Liquidos",233300516A0221,10-mar.-23,31-jul.-23,Vigente
"Química Franco Mexicana Nordin,
S.A. de C.V.",Lomas Altas No. 292,Lomas del Valle,45129,Zapopan,Jalisco,14120020013,06-ene.-05,"SÓLIDOS ORALES: Tabletas, Tabletas masticables,
Comprimidos, Polvo para reconstituir, Trocisco; LÍQUIDOS ORALES: Solución, Elixir, Jarabe; LÍQUIDOS NO ORALES: Solución; SEMISÓLIDOS: Crema,
Ungüento, Gel.",Vigente,Vigente,Ninguna,"Sólidos Orales, Líquidos Orales, Líquidos No Orales, Semisólidos.",223300EL531137,01-dic.-22,01-jun.-25,Vigente
"Química y Farmacia, S.A. de C.V.",Aut. Saltillo-Monterrey  KM 11.5,Capellania,25900,Ramos Arizpe,Coahuila,05027020003,18-sep.-14,"LÍQUIDOS ORALES: Solución, Suspensión, Jarabe; LÍQUIDOS NO ORALES: Solución; SEMISÓLIDOS:
Crema, Ungüento, Pasta, Gel.",Vigente,Vigente,Ninguna,"Líquidos orales, Líquidos no Orales y Semisólido",223300EL531860,27-ene.-23,27-jul.-25,Vigente
"Química y Farmacia, S.A. de C.V.",Blvd. Ind. Automotriz No.3045 Fracc.II,Parque Industrial Saltillo Ramos Arizpe,25900,Ramos Arizpe,Coahuila,05027020004,11-may.-11,"SÓLIDOS ORALES: Tabletas, Tabletas de liberación
prolongada, Tabletas masticables, Comprimidos, Cápsulas de gelatina dura, Cápsulas de gelatina dura de liberación prolongada, Granulado, Grageas,
Grageas de liberación prolongada.",Vigente,Vigente,Ninguna,Sólidos orales.,COFEPRIS-CAS-SELS-5364- 2023,31-ene.-23,31-jul.-25,Vigente
"Quintaesencia Laboratorios, S.A. de C.V.",Av. Minas No. 507 Bodega 7,Arvide,01280,Álvaro Obregón,D.F.,09001020010,06-jun.-12,"SÓLIDOS ORALES: Tabletas, Tabletas recubiertas, Cápsulas de gelatina dura, Grageas.",Revocada,Suspensión definitiva el 07 de agosto de 2017,Con fundamento en el  Artículo 380 Fracción XI de la Ley General de Salud,N/A,N/A,N/A,N/A,N/A
"Randall Laboratories, S.A. de C.V.",Lago Rodolfo No. 58,Granada,11520,Miguel Hidalgo,D.F.,09011020019,05-jul.-04,"SÓLIDOS ORALES: Tabletas; LÍQUIDOS ORALES:
Solución; ESTÉRILES: Solución inyectable en ampolleta.",Vigente,"Suspensión del 01 de enero de 2021  al 31 de diciembre de
2023",Con fundamento en el Artículo 202 de la Ley General de Salud,N/A,N/A,N/A,N/A,N/A
